author,title,link,year
Nakul Gopalan,Robot object retrieval with contextual natural language queries,https://scholar.google.com/citations?view_op=view_citation&hl=en&user=dPsQR14AAAAJ&citation_for_view=dPsQR14AAAAJ:5nxA0vEk-isC,2020
Nakul Gopalan,Accurately and efficiently interpreting human-robot instructions of varying granularities,https://scholar.google.com/citations?view_op=view_citation&hl=en&user=dPsQR14AAAAJ&citation_for_view=dPsQR14AAAAJ:zYLM7Y9cAGgC,2017
Nakul Gopalan,Review of machine learning and artificial intelligence (ML/AI) for the pediatric neurologist,https://scholar.google.com/citations?view_op=view_citation&hl=en&user=dPsQR14AAAAJ&citation_for_view=dPsQR14AAAAJ:L8Ckcad2t8MC,2023
Nakul Gopalan,"Flight, camera, action! using natural language and mixed reality to control a drone",https://scholar.google.com/citations?view_op=view_citation&hl=en&user=dPsQR14AAAAJ&citation_for_view=dPsQR14AAAAJ:_FxGoFyzp5QC,2019
Nakul Gopalan,Simultaneously learning transferable symbols and language groundings from perceptual data for instruction following,https://scholar.google.com/citations?view_op=view_citation&hl=en&user=dPsQR14AAAAJ&citation_for_view=dPsQR14AAAAJ:0EnyYjriUFMC,2020
Nakul Gopalan,Lancon-learn: Learning with language to enable generalization in multi-task manipulation,https://scholar.google.com/citations?view_op=view_citation&hl=en&user=dPsQR14AAAAJ&citation_for_view=dPsQR14AAAAJ:M3ejUd6NZC8C,2021
Nakul Gopalan,Grounding natural language instructions to semantic goal representations for abstraction and generalization,https://scholar.google.com/citations?view_op=view_citation&hl=en&user=dPsQR14AAAAJ&citation_for_view=dPsQR14AAAAJ:UeHWp8X0CEIC,2019
Nakul Gopalan,Modeling and solving human-robot collaborative tasks using pomdps,https://scholar.google.com/citations?view_op=view_citation&hl=en&user=dPsQR14AAAAJ&citation_for_view=dPsQR14AAAAJ:u5HHmVD_uO8C,2015
Nakul Gopalan,Guiding multi-step rearrangement tasks with natural language instructions,https://scholar.google.com/citations?view_op=view_citation&hl=en&user=dPsQR14AAAAJ&citation_for_view=dPsQR14AAAAJ:YOwf2qJgpHMC,2022
Nakul Gopalan,Grounding language attributes to objects using bayesian eigenobjects,https://scholar.google.com/citations?view_op=view_citation&hl=en&user=dPsQR14AAAAJ&citation_for_view=dPsQR14AAAAJ:LkGwnXOMwfcC,2019
Nakul Gopalan,A tale of two draggns: A hybrid approach for interpreting action-oriented and goal-oriented instructions,https://scholar.google.com/citations?view_op=view_citation&hl=en&user=dPsQR14AAAAJ&citation_for_view=dPsQR14AAAAJ:9yKSN-GCB0IC,2017
Nakul Gopalan,Natural language specification of reinforcement learning policies through differentiable decision trees,https://scholar.google.com/citations?view_op=view_citation&hl=en&user=dPsQR14AAAAJ&citation_for_view=dPsQR14AAAAJ:IWHjjKOFINEC,2023
Nakul Gopalan,Interpreting human-robot instructions,https://scholar.google.com/citations?view_op=view_citation&hl=en&user=dPsQR14AAAAJ&citation_for_view=dPsQR14AAAAJ:eQOLeE2rZwMC,2020
Nakul Gopalan,""" good robot! now watch this!"": Repurposing reinforcement learning for task-to-task transfer",https://scholar.google.com/citations?view_op=view_citation&hl=en&user=dPsQR14AAAAJ&citation_for_view=dPsQR14AAAAJ:_kc_bZDykSQC,2021
Rida Bazzi,The power of processor consistency,https://scholar.google.com/citations?view_op=view_citation&hl=en&user=FrMOlk8AAAAJ&citation_for_view=FrMOlk8AAAAJ:u5HHmVD_uO8C,1993
Rida Bazzi,Immediate Multi-Threaded Dynamic Software Updates Using Stack Reconstruction.,https://scholar.google.com/citations?view_op=view_citation&hl=en&user=FrMOlk8AAAAJ&citation_for_view=FrMOlk8AAAAJ:d1gkVwhDpl0C,2009
Rida Bazzi,On the establishment of distinct identities in overlay networks,https://scholar.google.com/citations?view_op=view_citation&hl=en&user=FrMOlk8AAAAJ&citation_for_view=FrMOlk8AAAAJ:u-x6o8ySG0sC,2007
Rida Bazzi,Leader election and shape formation with self-organizing programmable matter,https://scholar.google.com/citations?view_op=view_citation&hl=en&user=FrMOlk8AAAAJ&citation_for_view=FrMOlk8AAAAJ:hMod-77fHWUC,2015
Rida Bazzi,Synchronous Byzantine quorum systems,https://scholar.google.com/citations?view_op=view_citation&hl=en&user=FrMOlk8AAAAJ&citation_for_view=FrMOlk8AAAAJ:R3hNpaxXUhUC,1997
Rida Bazzi,On the availability of non-strict quorum systems,https://scholar.google.com/citations?view_op=view_citation&hl=en&user=FrMOlk8AAAAJ&citation_for_view=FrMOlk8AAAAJ:YsMSGLbcyi4C,2005
Rida Bazzi,Non-skipping timestamps for Byzantine data storage systems,https://scholar.google.com/citations?view_op=view_citation&hl=en&user=FrMOlk8AAAAJ&citation_for_view=FrMOlk8AAAAJ:9yKSN-GCB0IC,2004
Rida Bazzi,Using knowledge to optimally achieve coordination in distributed systems,https://scholar.google.com/citations?view_op=view_citation&hl=en&user=FrMOlk8AAAAJ&citation_for_view=FrMOlk8AAAAJ:3fE2CSJIrl8C,1999
Rida Bazzi,Simplifying fault-tolerance: providing the abstraction of crash failures,https://scholar.google.com/citations?view_op=view_citation&hl=en&user=FrMOlk8AAAAJ&citation_for_view=FrMOlk8AAAAJ:TFP_iSt0sucC,2001
Rida Bazzi,Bounded wait-free implementation of optimally resilient byzantine storage without (unproven) cryptographic assumptions,https://scholar.google.com/citations?view_op=view_citation&hl=en&user=FrMOlk8AAAAJ&citation_for_view=FrMOlk8AAAAJ:Y0pCki6q_DkC,2007
Rida Bazzi,Simulating crash failures with many faulty processors,https://scholar.google.com/citations?view_op=view_citation&hl=en&user=FrMOlk8AAAAJ&citation_for_view=FrMOlk8AAAAJ:qjMakFHDy7sC,1992
Rida Bazzi,Matrix signatures: From macs to digital signatures in distributed systems,https://scholar.google.com/citations?view_op=view_citation&hl=en&user=FrMOlk8AAAAJ&citation_for_view=FrMOlk8AAAAJ:WF5omc3nYNoC,2008
Rida Bazzi,Heterogeneous checkpointing for multithreaded applications,https://scholar.google.com/citations?view_op=view_citation&hl=en&user=FrMOlk8AAAAJ&citation_for_view=FrMOlk8AAAAJ:W7OEmFMy1HYC,2002
Rida Bazzi,Planar quorums,https://scholar.google.com/citations?view_op=view_citation&hl=en&user=FrMOlk8AAAAJ&citation_for_view=FrMOlk8AAAAJ:r0BpntZqJG4C,1996
Rida Bazzi,Compiler-assisted heterogeneous checkpointing,https://scholar.google.com/citations?view_op=view_citation&hl=en&user=FrMOlk8AAAAJ&citation_for_view=FrMOlk8AAAAJ:zYLM7Y9cAGgC,2001
Rida Bazzi,A captcha based on the human visual systems masking characteristics,https://scholar.google.com/citations?view_op=view_citation&hl=en&user=FrMOlk8AAAAJ&citation_for_view=FrMOlk8AAAAJ:hqOjcs7Dif8C,2006
Rida Bazzi,Autonomous vehicles and liability: What will juries do?,https://scholar.google.com/citations?view_op=view_citation&hl=en&user=FrMOlk8AAAAJ&citation_for_view=FrMOlk8AAAAJ:yD5IFk8b50cC,2020
Rida Bazzi,Stationary and deterministic leader election in self-organizing particle systems,https://scholar.google.com/citations?view_op=view_citation&hl=en&user=FrMOlk8AAAAJ&citation_for_view=FrMOlk8AAAAJ:P5F9QuxV20EC,2019
Rida Bazzi,A gap theorem for consensus types extended abstract,https://scholar.google.com/citations?view_op=view_citation&hl=en&user=FrMOlk8AAAAJ&citation_for_view=FrMOlk8AAAAJ:Tyk-4Ss8FVUC,1994
Rida Bazzi,Dynamic software updates: The state mapping problem,https://scholar.google.com/citations?view_op=view_citation&hl=en&user=FrMOlk8AAAAJ&citation_for_view=FrMOlk8AAAAJ:0EnyYjriUFMC,2009
Robert Atkinson,Learning from examples: Instructional principles from the worked examples research,https://scholar.google.com/citations?view_op=view_citation&hl=en&user=UzNoXwMAAAAJ&citation_for_view=UzNoXwMAAAAJ:u5HHmVD_uO8C,2000
Robert Atkinson,Structuring the transition from example study to problem solving in cognitive skill acquisition: A cognitive load perspective,https://scholar.google.com/citations?view_op=view_citation&hl=en&user=UzNoXwMAAAAJ&citation_for_view=UzNoXwMAAAAJ:d1gkVwhDpl0C,2016
Robert Atkinson,Optimizing learning from examples using animated pedagogical agents.,https://scholar.google.com/citations?view_op=view_citation&hl=en&user=UzNoXwMAAAAJ&citation_for_view=UzNoXwMAAAAJ:u-x6o8ySG0sC,2002
Robert Atkinson,Transitioning from studying examples to solving problems: Effects of self-explanation prompts and fading worked-out steps.,https://scholar.google.com/citations?view_op=view_citation&hl=en&user=UzNoXwMAAAAJ&citation_for_view=UzNoXwMAAAAJ:2osOgNQ5qMEC,2003
Robert Atkinson,Fostering social agency in multimedia learning: Examining the impact of an animated agent’s voice,https://scholar.google.com/citations?view_op=view_citation&hl=en&user=UzNoXwMAAAAJ&citation_for_view=UzNoXwMAAAAJ:UeHWp8X0CEIC,2005
Robert Atkinson,From example study to problem solving: Smooth transitions help learning,https://scholar.google.com/citations?view_op=view_citation&hl=en&user=UzNoXwMAAAAJ&citation_for_view=UzNoXwMAAAAJ:9yKSN-GCB0IC,2002
Robert Atkinson,How fading worked solution steps works–a cognitive load perspective,https://scholar.google.com/citations?view_op=view_citation&hl=en&user=UzNoXwMAAAAJ&citation_for_view=UzNoXwMAAAAJ:qjMakFHDy7sC,2004
Robert Atkinson,Using animations and visual cueing to support learning of scientific concepts and processes,https://scholar.google.com/citations?view_op=view_citation&hl=en&user=UzNoXwMAAAAJ&citation_for_view=UzNoXwMAAAAJ:5nxA0vEk-isC,2011
Robert Atkinson,Fostering multimedia learning of science: Exploring the role of an animated agent’s image,https://scholar.google.com/citations?view_op=view_citation&hl=en&user=UzNoXwMAAAAJ&citation_for_view=UzNoXwMAAAAJ:Tyk-4Ss8FVUC,2007
Robert Atkinson,Encountering the expertise reversal effect with a computer-based environment on electrical circuit analysis,https://scholar.google.com/citations?view_op=view_citation&hl=en&user=UzNoXwMAAAAJ&citation_for_view=UzNoXwMAAAAJ:W7OEmFMy1HYC,2006
Robert Atkinson,Animated pedagogical agents: Does their degree of embodiment impact learning from static or animated worked examples?,https://scholar.google.com/citations?view_op=view_citation&hl=en&user=UzNoXwMAAAAJ&citation_for_view=UzNoXwMAAAAJ:eQOLeE2rZwMC,2007
Robert Atkinson,Interactive example-based learning environments: Using interactive elements to encourage effective processing of worked examples,https://scholar.google.com/citations?view_op=view_citation&hl=en&user=UzNoXwMAAAAJ&citation_for_view=UzNoXwMAAAAJ:YsMSGLbcyi4C,2007
Robert Atkinson,Animated agents and learning: Does the type of verbal feedback they provide matter?,https://scholar.google.com/citations?view_op=view_citation&hl=en&user=UzNoXwMAAAAJ&citation_for_view=UzNoXwMAAAAJ:ns9cj8rnVeAC,2013
Robert Atkinson,Interactive learning environments: Contemporary issues and trends. An introduction to the special issue,https://scholar.google.com/citations?view_op=view_citation&hl=en&user=UzNoXwMAAAAJ&citation_for_view=UzNoXwMAAAAJ:ufrVoPGSRksC,2007
Robert Atkinson,From studying examples to solving problems: Fading worked-out solution steps helps learning,https://scholar.google.com/citations?view_op=view_citation&hl=en&user=UzNoXwMAAAAJ&citation_for_view=UzNoXwMAAAAJ:IjCSPb-OGe4C,2000
Robert Atkinson,Learning from examples: Fostering self-explanations in computer-based learning environments,https://scholar.google.com/citations?view_op=view_citation&hl=en&user=UzNoXwMAAAAJ&citation_for_view=UzNoXwMAAAAJ:Y0pCki6q_DkC,2002
Robert Atkinson,Investigating the impact of pedagogical agent gender matching and learner choice on learning outcomes and perceptions,https://scholar.google.com/citations?view_op=view_citation&hl=en&user=UzNoXwMAAAAJ&citation_for_view=UzNoXwMAAAAJ:BqipwSGYUEgC,2013
Robert Atkinson,Learning from worked-out examples and problem solving.,https://scholar.google.com/citations?view_op=view_citation&hl=en&user=UzNoXwMAAAAJ&citation_for_view=UzNoXwMAAAAJ:P5F9QuxV20EC,2010
Robert Atkinson,Transitioning from studying examples to solving problems: Combining fadijig with prompting foster learning.,https://scholar.google.com/citations?view_op=view_citation&hl=en&user=UzNoXwMAAAAJ&citation_for_view=UzNoXwMAAAAJ:zYLM7Y9cAGgC,2003
Robert Atkinson,Aiding transfer in statistics: examining the use of conceptually oriented equations and elaborations during subgoal learning.,https://scholar.google.com/citations?view_op=view_citation&hl=en&user=UzNoXwMAAAAJ&citation_for_view=UzNoXwMAAAAJ:WF5omc3nYNoC,2003
Ross Maciejewski,Graph convolutional networks: a comprehensive review,https://scholar.google.com/citations?view_op=view_citation&hl=en&user=nChgOjEAAAAJ&citation_for_view=nChgOjEAAAAJ:g3aElNc5_aQC,2019
Ross Maciejewski,Spatiotemporal social media analytics for abnormal event detection and examination using seasonal-trend decomposition,https://scholar.google.com/citations?view_op=view_citation&hl=en&user=nChgOjEAAAAJ&citation_for_view=nChgOjEAAAAJ:R3hNpaxXUhUC,2012
Ross Maciejewski,An overview of sentiment analysis in social media and its applications in disaster relief,https://scholar.google.com/citations?view_op=view_citation&hl=en&user=nChgOjEAAAAJ&citation_for_view=nChgOjEAAAAJ:P5F9QuxV20EC,2016
Ross Maciejewski,Visual analytics law enforcement tools,https://scholar.google.com/citations?view_op=view_citation&hl=en&user=nChgOjEAAAAJ&citation_for_view=nChgOjEAAAAJ:yB1At4FlUx8C,2014
Ross Maciejewski,A visual analytics approach to understanding spatiotemporal hotspots,https://scholar.google.com/citations?view_op=view_citation&hl=en&user=nChgOjEAAAAJ&citation_for_view=nChgOjEAAAAJ:d1gkVwhDpl0C,2009
Ross Maciejewski,Sky View Factor footprints for urban climate modeling,https://scholar.google.com/citations?view_op=view_citation&hl=en&user=nChgOjEAAAAJ&citation_for_view=nChgOjEAAAAJ:tKAzc9rXhukC,2018
Ross Maciejewski,Urban form and composition of street canyons: A human-centric big data and deep learning approach,https://scholar.google.com/citations?view_op=view_citation&hl=en&user=nChgOjEAAAAJ&citation_for_view=nChgOjEAAAAJ:VLnqNzywnoUC,2019
Ross Maciejewski,Visual analytics of mobility and transportation: State of the art and further research directions,https://scholar.google.com/citations?view_op=view_citation&hl=en&user=nChgOjEAAAAJ&citation_for_view=nChgOjEAAAAJ:tkaPQYYpVKoC,2017
Ross Maciejewski,Inform: Individual fairness on graph mining,https://scholar.google.com/citations?view_op=view_citation&hl=en&user=nChgOjEAAAAJ&citation_for_view=nChgOjEAAAAJ:e_rmSamDkqQC,2020
Ross Maciejewski,Structuring feature space: A non-parametric method for volumetric transfer function generation,https://scholar.google.com/citations?view_op=view_citation&hl=en&user=nChgOjEAAAAJ&citation_for_view=nChgOjEAAAAJ:u-x6o8ySG0sC,2009
Ross Maciejewski,"A visual analytics system for exploring, monitoring, and forecasting road traffic congestion",https://scholar.google.com/citations?view_op=view_citation&hl=en&user=nChgOjEAAAAJ&citation_for_view=nChgOjEAAAAJ:ruyezt5ZtCIC,2019
Ross Maciejewski,The state‐of‐the‐art in predictive visual analytics,https://scholar.google.com/citations?view_op=view_citation&hl=en&user=nChgOjEAAAAJ&citation_for_view=nChgOjEAAAAJ:WqliGbK-hY8C,2017
Ross Maciejewski,VAUD: A visual analysis approach for exploring spatio-temporal urban data,https://scholar.google.com/citations?view_op=view_citation&hl=en&user=nChgOjEAAAAJ&citation_for_view=nChgOjEAAAAJ:1yQoGdGgb4wC,2017
Ross Maciejewski,Forecasting hotspots—a predictive analytics approach,https://scholar.google.com/citations?view_op=view_citation&hl=en&user=nChgOjEAAAAJ&citation_for_view=nChgOjEAAAAJ:Se3iqnhoufwC,2010
Ross Maciejewski,Visualizing social media sentiment in disaster scenarios,https://scholar.google.com/citations?view_op=view_citation&hl=en&user=nChgOjEAAAAJ&citation_for_view=nChgOjEAAAAJ:rO6llkc54NcC,2015
Ross Maciejewski,"Sky view factors from synthetic fisheye photos for thermal comfort routing--a case study in phoenix, Arizona",https://scholar.google.com/citations?view_op=view_citation&hl=en&user=nChgOjEAAAAJ&citation_for_view=nChgOjEAAAAJ:eMMeJKvmdy0C,2017
Ross Maciejewski,Visual analytics decision support environment for epidemic modeling and response evaluation,https://scholar.google.com/citations?view_op=view_citation&hl=en&user=nChgOjEAAAAJ&citation_for_view=nChgOjEAAAAJ:_kc_bZDykSQC,2011
Ross Maciejewski,"Stakeholder analysis for the food-energy-water nexus in Phoenix, Arizona: Implications for nexus governance",https://scholar.google.com/citations?view_op=view_citation&hl=en&user=nChgOjEAAAAJ&citation_for_view=nChgOjEAAAAJ:dQ2og3OwTAUC,2017
Ross Maciejewski,Volume estimation using food specific shape templates in mobile image-based dietary assessment,https://scholar.google.com/citations?view_op=view_citation&hl=en&user=nChgOjEAAAAJ&citation_for_view=nChgOjEAAAAJ:aqlVkmm33-oC,2011
Ross Maciejewski,Proactive spatiotemporal resource allocation and predictive visual analytics for community policing and law enforcement,https://scholar.google.com/citations?view_op=view_citation&hl=en&user=nChgOjEAAAAJ&citation_for_view=nChgOjEAAAAJ:M05iB0D1s5AC,2014
Sarma Vrudhula,Throughput-optimized OpenCL-based FPGA accelerator for large-scale convolutional neural networks,https://scholar.google.com/citations?view_op=view_citation&hl=en&user=_FL8mW8AAAAJ&citation_for_view=_FL8mW8AAAAJ:TIZ-Mc8IlK0C,2016
Sarma Vrudhula,Battery modeling for energy aware system design,https://scholar.google.com/citations?view_op=view_citation&hl=en&user=_FL8mW8AAAAJ&citation_for_view=_FL8mW8AAAAJ:UebtZRa9Y70C,2003
Sarma Vrudhula,Predictive modeling of the NBTI effect for reliable design,https://scholar.google.com/citations?view_op=view_citation&hl=en&user=_FL8mW8AAAAJ&citation_for_view=_FL8mW8AAAAJ:tuHXwOkdijsC,2006
Sarma Vrudhula,Optimizing loop operation and dataflow in FPGA acceleration of deep convolutional neural networks,https://scholar.google.com/citations?view_op=view_citation&hl=en&user=_FL8mW8AAAAJ&citation_for_view=_FL8mW8AAAAJ:NhqRSupF_l8C,2017
Sarma Vrudhula,Optimizing the convolution operation to accelerate deep neural networks on FPGA,https://scholar.google.com/citations?view_op=view_citation&hl=en&user=_FL8mW8AAAAJ&citation_for_view=_FL8mW8AAAAJ:Fu2w8maKXqMC,2018
Sarma Vrudhula,An analytical high-level battery model for use in energy management of portable electronic systems,https://scholar.google.com/citations?view_op=view_citation&hl=en&user=_FL8mW8AAAAJ&citation_for_view=_FL8mW8AAAAJ:LPZeul_q3PIC,2001
Sarma Vrudhula,"The impact of NBTI effect on combinational circuit: Modeling, simulation, and analysis",https://scholar.google.com/citations?view_op=view_citation&hl=en&user=_FL8mW8AAAAJ&citation_for_view=_FL8mW8AAAAJ:-f6ydRqryjwC,2009
Sarma Vrudhula,Energy management for battery-powered embedded systems,https://scholar.google.com/citations?view_op=view_citation&hl=en&user=_FL8mW8AAAAJ&citation_for_view=_FL8mW8AAAAJ:Zph67rFs4hoC,2003
Sarma Vrudhula,A model for battery lifetime analysis for organizing applications on a pocket computer,https://scholar.google.com/citations?view_op=view_citation&hl=en&user=_FL8mW8AAAAJ&citation_for_view=_FL8mW8AAAAJ:JV2RwH3_ST0C,2004
Sarma Vrudhula,Mitigating effects of non-ideal synaptic device characteristics for on-chip learning,https://scholar.google.com/citations?view_op=view_citation&hl=en&user=_FL8mW8AAAAJ&citation_for_view=_FL8mW8AAAAJ:J_g5lzvAfSwC,2015
Sarma Vrudhula,The impact of NBTI on the performance of combinational and sequential circuits,https://scholar.google.com/citations?view_op=view_citation&hl=en&user=_FL8mW8AAAAJ&citation_for_view=_FL8mW8AAAAJ:VOx2b1Wkg3QC,2007
Sarma Vrudhula,Scalable and modularized RTL compilation of convolutional neural networks onto FPGA,https://scholar.google.com/citations?view_op=view_citation&hl=en&user=_FL8mW8AAAAJ&citation_for_view=_FL8mW8AAAAJ:738O_yMBCRsC,2016
Sarma Vrudhula,Edge-valued binary decision for multi-level hierarchical verification,https://scholar.google.com/citations?view_op=view_citation&hl=en&user=_FL8mW8AAAAJ&citation_for_view=_FL8mW8AAAAJ:4fGpz3EwCPoC,1992
Sarma Vrudhula,BDD based decomposition of logic functions with application to FPGA synthesis,https://scholar.google.com/citations?view_op=view_citation&hl=en&user=_FL8mW8AAAAJ&citation_for_view=_FL8mW8AAAAJ:tOudhMTPpwUC,1993
Sarma Vrudhula,Statistical timing analysis using bounds and selective enumeration,https://scholar.google.com/citations?view_op=view_citation&hl=en&user=_FL8mW8AAAAJ&citation_for_view=_FL8mW8AAAAJ:XoXfffV-tXoC,2002
Sarma Vrudhula,EPIMap: Using epimorphism to map applications on CGRAs,https://scholar.google.com/citations?view_op=view_citation&hl=en&user=_FL8mW8AAAAJ&citation_for_view=_FL8mW8AAAAJ:dshw04ExmUIC,2012
Sarma Vrudhula,"EVBDD-based algorithms for integer linear programming, spectral transformation, and function decomposition",https://scholar.google.com/citations?view_op=view_citation&hl=en&user=_FL8mW8AAAAJ&citation_for_view=_FL8mW8AAAAJ:QIV2ME_5wuYC,2002
Sarma Vrudhula,An automatic RTL compiler for high-throughput FPGA implementation of diverse deep convolutional neural networks,https://scholar.google.com/citations?view_op=view_citation&hl=en&user=_FL8mW8AAAAJ&citation_for_view=_FL8mW8AAAAJ:BwyfMAYsbu0C,2017
Sarma Vrudhula,Fully parallel write/read in resistive synaptic array for accelerating on-chip learning,https://scholar.google.com/citations?view_op=view_citation&hl=en&user=_FL8mW8AAAAJ&citation_for_view=_FL8mW8AAAAJ:W5xh706n7nkC,2015
Sarma Vrudhula,"Energy-efficient operation of multicore processors by DVFS, task migration, and active cooling",https://scholar.google.com/citations?view_op=view_citation&hl=en&user=_FL8mW8AAAAJ&citation_for_view=_FL8mW8AAAAJ:RHpTSmoSYBkC,2012
Sethuraman Panchanathan,Deep hashing network for unsupervised domain adaptation,https://scholar.google.com/citations?view_op=view_citation&hl=en&user=GKTKZ8kAAAAJ&citation_for_view=GKTKZ8kAAAAJ:NZNkWSpQBv0C,2017
Sethuraman Panchanathan,Review of image and video indexing techniques,https://scholar.google.com/citations?view_op=view_citation&hl=en&user=GKTKZ8kAAAAJ&citation_for_view=GKTKZ8kAAAAJ:u5HHmVD_uO8C,1997
Sethuraman Panchanathan,Multimodal emotion recognition using deep learning architectures,https://scholar.google.com/citations?view_op=view_citation&hl=en&user=GKTKZ8kAAAAJ&citation_for_view=GKTKZ8kAAAAJ:uUvzmPk0f8oC,2016
Sethuraman Panchanathan,Effect of fatigue on psychomotor and cognitive skills,https://scholar.google.com/citations?view_op=view_citation&hl=en&user=GKTKZ8kAAAAJ&citation_for_view=GKTKZ8kAAAAJ:UeHWp8X0CEIC,2008
Sethuraman Panchanathan,Error resiliency schemes in H. 264/AVC standard,https://scholar.google.com/citations?view_op=view_citation&hl=en&user=GKTKZ8kAAAAJ&citation_for_view=GKTKZ8kAAAAJ:9yKSN-GCB0IC,2006
Sethuraman Panchanathan,Image indexing using moments and wavelets,https://scholar.google.com/citations?view_op=view_citation&hl=en&user=GKTKZ8kAAAAJ&citation_for_view=GKTKZ8kAAAAJ:u-x6o8ySG0sC,2002
Sethuraman Panchanathan,Multisource domain adaptation and its application to early detection of fatigue,https://scholar.google.com/citations?view_op=view_citation&hl=en&user=GKTKZ8kAAAAJ&citation_for_view=GKTKZ8kAAAAJ:j8SEvjWlNXcC,2012
Sethuraman Panchanathan,VLSI implementation of discrete wavelet transform,https://scholar.google.com/citations?view_op=view_citation&hl=en&user=GKTKZ8kAAAAJ&citation_for_view=GKTKZ8kAAAAJ:d1gkVwhDpl0C,1996
Sethuraman Panchanathan,A critical evaluation of image and video indexing techniques in the compressed domain,https://scholar.google.com/citations?view_op=view_citation&hl=en&user=GKTKZ8kAAAAJ&citation_for_view=GKTKZ8kAAAAJ:rTD5ala9j4wC,1999
Sethuraman Panchanathan,A two-stage weighting framework for multi-source domain adaptation,https://scholar.google.com/citations?view_op=view_citation&hl=en&user=GKTKZ8kAAAAJ&citation_for_view=GKTKZ8kAAAAJ:SjuI4pbJlxcC,2011
Sethuraman Panchanathan,Reconfigurable processing,https://scholar.google.com/citations?view_op=view_citation&hl=en&user=GKTKZ8kAAAAJ&citation_for_view=GKTKZ8kAAAAJ:owLR8QvbtFgC,2012
Sethuraman Panchanathan,Biased manifold embedding: A framework for person-independent head pose estimation,https://scholar.google.com/citations?view_op=view_citation&hl=en&user=GKTKZ8kAAAAJ&citation_for_view=GKTKZ8kAAAAJ:W7OEmFMy1HYC,2007
Sethuraman Panchanathan,Leveraging seen and unseen semantic relationships for generative zero-shot learning,https://scholar.google.com/citations?view_op=view_citation&hl=en&user=GKTKZ8kAAAAJ&citation_for_view=GKTKZ8kAAAAJ:5F1dSjz1ScoC,2020
Sethuraman Panchanathan,A virtual reality simulator for orthopedic basic skills: a design and validation study,https://scholar.google.com/citations?view_op=view_citation&hl=en&user=GKTKZ8kAAAAJ&citation_for_view=GKTKZ8kAAAAJ:nrtMV_XWKgEC,2010
Sethuraman Panchanathan,Automated gesture segmentation from dance sequences,https://scholar.google.com/citations?view_op=view_citation&hl=en&user=GKTKZ8kAAAAJ&citation_for_view=GKTKZ8kAAAAJ:qjMakFHDy7sC,2004
Sethuraman Panchanathan,Deep-learning systems for domain adaptation in computer vision: Learning transferable feature representations,https://scholar.google.com/citations?view_op=view_citation&hl=en&user=GKTKZ8kAAAAJ&citation_for_view=GKTKZ8kAAAAJ:IT1MJ6E3JesC,2017
Sethuraman Panchanathan,Using a haptic belt to convey non-verbal communication cues during social interactions to individuals who are blind,https://scholar.google.com/citations?view_op=view_citation&hl=en&user=GKTKZ8kAAAAJ&citation_for_view=GKTKZ8kAAAAJ:dhFuZR0502QC,2008
Sethuraman Panchanathan,Analysis of low resolution accelerometer data for continuous human activity recognition,https://scholar.google.com/citations?view_op=view_citation&hl=en&user=GKTKZ8kAAAAJ&citation_for_view=GKTKZ8kAAAAJ:ULOm3_A8WrAC,2008
Sethuraman Panchanathan,A methodology for evaluating robustness of face recognition algorithms with respect to variations in pose angle and illumination angle,https://scholar.google.com/citations?view_op=view_citation&hl=en&user=GKTKZ8kAAAAJ&citation_for_view=GKTKZ8kAAAAJ:Tyk-4Ss8FVUC,2005
