author,title,link,year
Sethuraman Panchanathan,Fast wavelet histogram techniques for image indexing,https://scholar.google.com/citations?view_op=view_citation&hl=en&user=GKTKZ8kAAAAJ&citation_for_view=GKTKZ8kAAAAJ:HJSXoJQnj-YC,1999
Siddharth Srivastava,Combined task and motion planning through an extensible planner-independent interface layer,https://scholar.google.com/citations?view_op=view_citation&hl=en&user=H3ZnCqYAAAAJ&citation_for_view=H3ZnCqYAAAAJ:W7OEmFMy1HYC,2014
Siddharth Srivastava,Anonymizing social networks,https://scholar.google.com/citations?view_op=view_citation&hl=en&user=H3ZnCqYAAAAJ&citation_for_view=H3ZnCqYAAAAJ:_kc_bZDykSQC,2007
Siddharth Srivastava,Anonymizing social networks,https://scholar.google.com/citations?view_op=view_citation&hl=en&user=H3ZnCqYAAAAJ&citation_for_view=H3ZnCqYAAAAJ:u5HHmVD_uO8C,2007
Siddharth Srivastava,Learning Generalized Reactive Policies using Deep Neural Networks,https://scholar.google.com/citations?view_op=view_citation&hl=en&user=H3ZnCqYAAAAJ&citation_for_view=H3ZnCqYAAAAJ:4DMP91E08xMC,2018
Siddharth Srivastava,A new representation and associated algorithms for generalized planning,https://scholar.google.com/citations?view_op=view_citation&hl=en&user=H3ZnCqYAAAAJ&citation_for_view=H3ZnCqYAAAAJ:9yKSN-GCB0IC,2011
Siddharth Srivastava,Platform-independent benchmarks for task and motion planning,https://scholar.google.com/citations?view_op=view_citation&hl=en&user=H3ZnCqYAAAAJ&citation_for_view=H3ZnCqYAAAAJ:JV2RwH3_ST0C,2018
Siddharth Srivastava,Hierarchical Expertise Level Modeling for User-Specific Contrastive Explanations,https://scholar.google.com/citations?view_op=view_citation&hl=en&user=H3ZnCqYAAAAJ&citation_for_view=H3ZnCqYAAAAJ:aqlVkmm33-oC,2018
Siddharth Srivastava,Simulating reachability using first-order logic with applications to verification of linked data structures,https://scholar.google.com/citations?view_op=view_citation&hl=en&user=H3ZnCqYAAAAJ&citation_for_view=H3ZnCqYAAAAJ:2osOgNQ5qMEC,2009
Siddharth Srivastava,Guided search for task and motion plans using learned heuristics,https://scholar.google.com/citations?view_op=view_citation&hl=en&user=H3ZnCqYAAAAJ&citation_for_view=H3ZnCqYAAAAJ:YOwf2qJgpHMC,2016
Siddharth Srivastava,Guided Search for Task and Motion Plans Using Learned Heuristics,https://scholar.google.com/citations?view_op=view_citation&hl=en&user=H3ZnCqYAAAAJ&citation_for_view=H3ZnCqYAAAAJ:QIV2ME_5wuYC,2016
Siddharth Srivastava,Learning Generalized Plans Using Abstract Counting.,https://scholar.google.com/citations?view_op=view_citation&hl=en&user=H3ZnCqYAAAAJ&citation_for_view=H3ZnCqYAAAAJ:d1gkVwhDpl0C,2008
Siddharth Srivastava,Why Can't You Do That HAL? Explaining Unsolvability of Planning Tasks,https://scholar.google.com/citations?view_op=view_citation&hl=en&user=H3ZnCqYAAAAJ&citation_for_view=H3ZnCqYAAAAJ:iH-uZ7U-co4C,2019
Siddharth Srivastava,A unified framework for planning in adversarial and cooperative environments,https://scholar.google.com/citations?view_op=view_citation&hl=en&user=H3ZnCqYAAAAJ&citation_for_view=H3ZnCqYAAAAJ:hMod-77fHWUC,2019
Siddharth Srivastava,Markovian State and Action Abstractions for MDPs via Hierarchical MCTS.,https://scholar.google.com/citations?view_op=view_citation&hl=en&user=H3ZnCqYAAAAJ&citation_for_view=H3ZnCqYAAAAJ:4TOpqqG69KYC,2016
Siddharth Srivastava,Learning Generalized Relational Heuristic Networks for Model-Agnostic Planning.,https://scholar.google.com/citations?view_op=view_citation&hl=en&user=H3ZnCqYAAAAJ&citation_for_view=H3ZnCqYAAAAJ:-f6ydRqryjwC,2021
Siddharth Srivastava,Using classical planners for tasks with continuous operators in robotics,https://scholar.google.com/citations?view_op=view_citation&hl=en&user=H3ZnCqYAAAAJ&citation_for_view=H3ZnCqYAAAAJ:qjMakFHDy7sC,2013
Siddharth Srivastava,Qualitative numeric planning,https://scholar.google.com/citations?view_op=view_citation&hl=en&user=H3ZnCqYAAAAJ&citation_for_view=H3ZnCqYAAAAJ:0EnyYjriUFMC,2011
Siddharth Srivastava,Bridging the Gap: Providing Post-Hoc Symbolic Explanations for Sequential Decision-Making Problems with Inscrutable Representations,https://scholar.google.com/citations?view_op=view_citation&hl=en&user=H3ZnCqYAAAAJ&citation_for_view=H3ZnCqYAAAAJ:_Qo2XoVZTnwC,2020
Siddharth Srivastava,Asking the Right Questions: Learning Interpretable Action Models Through Query Answering,https://scholar.google.com/citations?view_op=view_citation&hl=en&user=H3ZnCqYAAAAJ&citation_for_view=H3ZnCqYAAAAJ:mB3voiENLucC,2021
Siddharth Srivastava,Anytime integrated task and motion policies for stochastic environments,https://scholar.google.com/citations?view_op=view_citation&hl=en&user=H3ZnCqYAAAAJ&citation_for_view=H3ZnCqYAAAAJ:hC7cP41nSMkC,2020
Srividya Bansal,Constraints on anomalous couplings from the production of Higgs bosons decaying to lepton pairs,https://scholar.google.com/citations?view_op=view_citation&hl=en&user=JoAxSpgAAAAJ&citation_for_view=JoAxSpgAAAAJ:xtoqd-5pKcoC,2019
Srividya Bansal,Towards a semantic extract-transform-load (ETL) framework for big data integration,https://scholar.google.com/citations?view_op=view_citation&hl=en&user=JoAxSpgAAAAJ&citation_for_view=JoAxSpgAAAAJ:V3AGJWp-ZtQC,2014
Srividya Bansal,Integrating big data: A semantic extract-transform-load framework,https://scholar.google.com/citations?view_op=view_citation&hl=en&user=JoAxSpgAAAAJ&citation_for_view=JoAxSpgAAAAJ:t6usbXjVLHcC,2015
Srividya Bansal,Automatic composition of semantic web services,https://scholar.google.com/citations?view_op=view_citation&hl=en&user=JoAxSpgAAAAJ&citation_for_view=JoAxSpgAAAAJ:Tyk-4Ss8FVUC,2007
Srividya Bansal,Generalized semantics-based service composition,https://scholar.google.com/citations?view_op=view_citation&hl=en&user=JoAxSpgAAAAJ&citation_for_view=JoAxSpgAAAAJ:Y0pCki6q_DkC,2008
Srividya Bansal,Trust-based dynamic web service composition using social network analysis,https://scholar.google.com/citations?view_op=view_citation&hl=en&user=JoAxSpgAAAAJ&citation_for_view=JoAxSpgAAAAJ:u-x6o8ySG0sC,2010
Srividya Bansal,WSC-2009: a quality of service-oriented web services challenge,https://scholar.google.com/citations?view_op=view_citation&hl=en&user=JoAxSpgAAAAJ&citation_for_view=JoAxSpgAAAAJ:WF5omc3nYNoC,2009
Srividya Bansal,WSC-08: continuing the web services challenge,https://scholar.google.com/citations?view_op=view_citation&hl=en&user=JoAxSpgAAAAJ&citation_for_view=JoAxSpgAAAAJ:ufrVoPGSRksC,2008
Srividya Bansal,Template-based question answering using recursive neural networks,https://scholar.google.com/citations?view_op=view_citation&hl=en&user=JoAxSpgAAAAJ&citation_for_view=JoAxSpgAAAAJ:S16KYo8Pm5AC,2021
Srividya Bansal,A universal service-semantics description language,https://scholar.google.com/citations?view_op=view_citation&hl=en&user=JoAxSpgAAAAJ&citation_for_view=JoAxSpgAAAAJ:W7OEmFMy1HYC,2005
Srividya Bansal,Usdl: A service-semantics description language for automatic service discovery and composition,https://scholar.google.com/citations?view_op=view_citation&hl=en&user=JoAxSpgAAAAJ&citation_for_view=JoAxSpgAAAAJ:YsMSGLbcyi4C,2009
Srividya Bansal,Generalized semantic Web service composition,https://scholar.google.com/citations?view_op=view_citation&hl=en&user=JoAxSpgAAAAJ&citation_for_view=JoAxSpgAAAAJ:1qzjygNMrQYC,2016
Srividya Bansal,A project spine for software engineering curricular design,https://scholar.google.com/citations?view_op=view_citation&hl=en&user=JoAxSpgAAAAJ&citation_for_view=JoAxSpgAAAAJ:q3oQSFYPqjQC,2013
Srividya Bansal,Workflow composition of service level agreements for web services,https://scholar.google.com/citations?view_op=view_citation&hl=en&user=JoAxSpgAAAAJ&citation_for_view=JoAxSpgAAAAJ:kNdYIx-mwKoC,2012
Srividya Bansal,MOOCLink: Building and utilizing linked data from massive open online courses,https://scholar.google.com/citations?view_op=view_citation&hl=en&user=JoAxSpgAAAAJ&citation_for_view=JoAxSpgAAAAJ:wbdj-CoPYUoC,2015
Srividya Bansal,Ontoconnect: Unsupervised ontology alignment with recursive neural network,https://scholar.google.com/citations?view_op=view_citation&hl=en&user=JoAxSpgAAAAJ&citation_for_view=JoAxSpgAAAAJ:0N-VGjzr574C,2021
Srividya Bansal,Web service discovery and composition using usdl,https://scholar.google.com/citations?view_op=view_citation&hl=en&user=JoAxSpgAAAAJ&citation_for_view=JoAxSpgAAAAJ:eQOLeE2rZwMC,2006
Srividya Bansal,Identifying trends in technologies and programming languages using topic modeling,https://scholar.google.com/citations?view_op=view_citation&hl=en&user=JoAxSpgAAAAJ&citation_for_view=JoAxSpgAAAAJ:vDijr-p_gm4C,2018
Srividya Bansal,Semantic etl—state-of-the-art and open research challenges,https://scholar.google.com/citations?view_op=view_citation&hl=en&user=JoAxSpgAAAAJ&citation_for_view=JoAxSpgAAAAJ:VLnqNzywnoUC,2017
Srividya Bansal,Outcome-based Education model for computer science Education,https://scholar.google.com/citations?view_op=view_citation&hl=en&user=JoAxSpgAAAAJ&citation_for_view=JoAxSpgAAAAJ:J-pR_7NvFogC,2015
Stephanie Forrest,Self-nonself discrimination in a computer,https://scholar.google.com/citations?view_op=view_citation&hl=en&user=XaqH-G8AAAAJ&citation_for_view=XaqH-G8AAAAJ:anf4URPfarAC,1994
Stephanie Forrest,A sense of self for unix processes,https://scholar.google.com/citations?view_op=view_citation&hl=en&user=XaqH-G8AAAAJ&citation_for_view=XaqH-G8AAAAJ:2P1L_qKh6hAC,1996
Stephanie Forrest,Intrusion detection using sequences of system calls,https://scholar.google.com/citations?view_op=view_citation&hl=en&user=XaqH-G8AAAAJ&citation_for_view=XaqH-G8AAAAJ:ufrVoPGSRksC,1998
Stephanie Forrest,Detecting intrusions using system calls: Alternative data models,https://scholar.google.com/citations?view_op=view_citation&hl=en&user=XaqH-G8AAAAJ&citation_for_view=XaqH-G8AAAAJ:tkaPQYYpVKoC,1999
Stephanie Forrest,Architecture for an artificial immune system,https://scholar.google.com/citations?view_op=view_citation&hl=en&user=XaqH-G8AAAAJ&citation_for_view=XaqH-G8AAAAJ:NJ774b8OgUMC,2000
Stephanie Forrest,Genprog: A generic method for automatic software repair,https://scholar.google.com/citations?view_op=view_citation&hl=en&user=XaqH-G8AAAAJ&citation_for_view=XaqH-G8AAAAJ:uc_IGeMz5qoC,2011
Stephanie Forrest,Genetic algorithms: principles of natural selection applied to computation,https://scholar.google.com/citations?view_op=view_citation&hl=en&user=XaqH-G8AAAAJ&citation_for_view=XaqH-G8AAAAJ:HbR8gkJAVGIC,1993
Stephanie Forrest,Computer immunology,https://scholar.google.com/citations?view_op=view_citation&hl=en&user=XaqH-G8AAAAJ&citation_for_view=XaqH-G8AAAAJ:0N-VGjzr574C,1997
Stephanie Forrest,Email networks and the spread of computer viruses,https://scholar.google.com/citations?view_op=view_citation&hl=en&user=XaqH-G8AAAAJ&citation_for_view=XaqH-G8AAAAJ:2osOgNQ5qMEC,2002
Stephanie Forrest,Fitness distance correlation as a measure of problem difficulty for genetic algorithms.,https://scholar.google.com/citations?view_op=view_citation&hl=en&user=XaqH-G8AAAAJ&citation_for_view=XaqH-G8AAAAJ:V3AGJWp-ZtQC,1995
Stephanie Forrest,Automatically finding patches using genetic programming,https://scholar.google.com/citations?view_op=view_citation&hl=en&user=XaqH-G8AAAAJ&citation_for_view=XaqH-G8AAAAJ:t6usbXjVLHcC,2009
Stephanie Forrest,The royal road for genetic algorithms: Fitness landscapes and GA performance,https://scholar.google.com/citations?view_op=view_citation&hl=en&user=XaqH-G8AAAAJ&citation_for_view=XaqH-G8AAAAJ:0KyAp5RtaNEC,1991
Stephanie Forrest,A systematic study of automated program repair: Fixing 55 out of 105 bugs for $8 each,https://scholar.google.com/citations?view_op=view_citation&hl=en&user=XaqH-G8AAAAJ&citation_for_view=XaqH-G8AAAAJ:1sJd4Hv_s6UC,2012
Stephanie Forrest,Building diverse computer systems,https://scholar.google.com/citations?view_op=view_citation&hl=en&user=XaqH-G8AAAAJ&citation_for_view=XaqH-G8AAAAJ:ruyezt5ZtCIC,1997
Stephanie Forrest,"Emergent computation: Self-organizing, collective, and cooperative phenomena in natural and artificial computing networks: Introduction to the proceedings of the ninth annual …",https://scholar.google.com/citations?view_op=view_citation&hl=en&user=XaqH-G8AAAAJ&citation_for_view=XaqH-G8AAAAJ:ILKRHgRFtOwC,1990
Stephanie Forrest,"An immunological approach to change detection: Algorithms, analysis and implications",https://scholar.google.com/citations?view_op=view_citation&hl=en&user=XaqH-G8AAAAJ&citation_for_view=XaqH-G8AAAAJ:ZeXyd9-uunAC,1996
Stephanie Forrest,Relative building-block fitness and the building-block hypothesis,https://scholar.google.com/citations?view_op=view_citation&hl=en&user=XaqH-G8AAAAJ&citation_for_view=XaqH-G8AAAAJ:BqipwSGYUEgC,1993
Stephanie Forrest,Genetic algorithms,https://scholar.google.com/citations?view_op=view_citation&hl=en&user=XaqH-G8AAAAJ&citation_for_view=XaqH-G8AAAAJ:fEOibwPWpKIC,1996
Stephanie Forrest,When will a genetic algorithm outperform hill climbing,https://scholar.google.com/citations?view_op=view_citation&hl=en&user=XaqH-G8AAAAJ&citation_for_view=XaqH-G8AAAAJ:yFnVuubrUp4C,1993
Stephanie Forrest,Randomized instruction set emulation to disrupt binary code injection attacks,https://scholar.google.com/citations?view_op=view_citation&hl=en&user=XaqH-G8AAAAJ&citation_for_view=XaqH-G8AAAAJ:WJVC3Jt7v1AC,2003
Stephen Yau,Reconfigurable context-sensitive middleware for pervasive computing,https://scholar.google.com/citations?view_op=view_citation&hl=en&user=yPr7vZgAAAAJ&citation_for_view=yPr7vZgAAAAJ:M7yex6snE4oC,2002
Stephen Yau,Dynamic audit services for outsourced storages in clouds,https://scholar.google.com/citations?view_op=view_citation&hl=en&user=yPr7vZgAAAAJ&citation_for_view=yPr7vZgAAAAJ:5icHVeHT4IsC,2011
Stephen Yau,Dynamic audit services for integrity verification of outsourced storages in clouds,https://scholar.google.com/citations?view_op=view_citation&hl=en&user=yPr7vZgAAAAJ&citation_for_view=yPr7vZgAAAAJ:lgwcVrK6X84C,2011
Stephen Yau,Some stability measures for software maintenance,https://scholar.google.com/citations?view_op=view_citation&hl=en&user=yPr7vZgAAAAJ&citation_for_view=yPr7vZgAAAAJ:ye4kPcJQO24C,2006
Stephen Yau,Ripple effect analysis of software maintenance,https://scholar.google.com/citations?view_op=view_citation&hl=en&user=yPr7vZgAAAAJ&citation_for_view=yPr7vZgAAAAJ:6bLC7aUMtPcC,1978
Stephen Yau,Design stability measures for software maintenance,https://scholar.google.com/citations?view_op=view_citation&hl=en&user=yPr7vZgAAAAJ&citation_for_view=yPr7vZgAAAAJ:uc_IGeMz5qoC,2006
Stephen Yau,Efficient provable data possession for hybrid clouds,https://scholar.google.com/citations?view_op=view_citation&hl=en&user=yPr7vZgAAAAJ&citation_for_view=yPr7vZgAAAAJ:CHSYGLWDkRkC,2010
Stephen Yau,A smart classroom for enhancing collaborative learning using pervasive computing technology,https://scholar.google.com/citations?view_op=view_citation&hl=en&user=yPr7vZgAAAAJ&citation_for_view=yPr7vZgAAAAJ:fPk4N6BV_jEC,2003
Stephen Yau,Associative processor architecture—A survey,https://scholar.google.com/citations?view_op=view_citation&hl=en&user=yPr7vZgAAAAJ&citation_for_view=yPr7vZgAAAAJ:AXPGKjj_ei8C,1977
Stephen Yau,An approach to concurrent control flow checking,https://scholar.google.com/citations?view_op=view_citation&hl=en&user=yPr7vZgAAAAJ&citation_for_view=yPr7vZgAAAAJ:ns9cj8rnVeAC,1980
Stephen Yau,Design of self-checking software,https://scholar.google.com/citations?view_op=view_citation&hl=en&user=yPr7vZgAAAAJ&citation_for_view=yPr7vZgAAAAJ:Mojj43d5GZwC,1975
Stephen Yau,Hierarchical situation modeling and reasoning for pervasive computing,https://scholar.google.com/citations?view_op=view_citation&hl=en&user=yPr7vZgAAAAJ&citation_for_view=yPr7vZgAAAAJ:8AbLer7MMksC,2006
Stephen Yau,An approach to QoS-based task distribution in edge computing networks for IoT applications,https://scholar.google.com/citations?view_op=view_citation&hl=en&user=yPr7vZgAAAAJ&citation_for_view=yPr7vZgAAAAJ:mNrWkgRL2YcC,2017
Stephen Yau,A survey of software design techniques,https://scholar.google.com/citations?view_op=view_citation&hl=en&user=yPr7vZgAAAAJ&citation_for_view=yPr7vZgAAAAJ:dTyEYWd-f8wC,2012
Stephen Yau,Development of situation-aware application software for ubiquitous computing environments,https://scholar.google.com/citations?view_op=view_citation&hl=en&user=yPr7vZgAAAAJ&citation_for_view=yPr7vZgAAAAJ:yxmsSjX2EkcC,2002
Stephen Yau,An adaptive middleware for context-sensitive communications for real-time applications in ubiquitous computing environments,https://scholar.google.com/citations?view_op=view_citation&hl=en&user=yPr7vZgAAAAJ&citation_for_view=yPr7vZgAAAAJ:lvd772isFD0C,2004
Stephen Yau,Efficient audit service outsourcing for data integrity in clouds,https://scholar.google.com/citations?view_op=view_citation&hl=en&user=yPr7vZgAAAAJ&citation_for_view=yPr7vZgAAAAJ:ULOm3_A8WrAC,2012
Stephen Yau,Testing context-sensitive middleware-based software applications,https://scholar.google.com/citations?view_op=view_citation&hl=en&user=yPr7vZgAAAAJ&citation_for_view=yPr7vZgAAAAJ:r_AWSJRzSzQC,2004
Stephen Yau,QoS-based service ranking and selection for service-based systems,https://scholar.google.com/citations?view_op=view_citation&hl=en&user=yPr7vZgAAAAJ&citation_for_view=yPr7vZgAAAAJ:5Ul4iDaHHb8C,2011
Stephen Yau,Universal logic modules and their applications,https://scholar.google.com/citations?view_op=view_citation&hl=en&user=yPr7vZgAAAAJ&citation_for_view=yPr7vZgAAAAJ:UebtZRa9Y70C,1970
Subbarao Kambhampati,What we instagram: A first analysis of instagram photo content and user types,https://scholar.google.com/citations?view_op=view_citation&hl=en&user=yl3L07sAAAAJ&citation_for_view=yl3L07sAAAAJ:uDGL6kOW6j0C,2014
Subbarao Kambhampati,Multiresolution path planning for mobile robots,https://scholar.google.com/citations?view_op=view_citation&hl=en&user=yl3L07sAAAAJ&citation_for_view=yl3L07sAAAAJ:u-x6o8ySG0sC,1986
Subbarao Kambhampati,A validation-structure-based theory of plan modification and reuse,https://scholar.google.com/citations?view_op=view_citation&hl=en&user=yl3L07sAAAAJ&citation_for_view=yl3L07sAAAAJ:u5HHmVD_uO8C,1992
Subbarao Kambhampati,Large language models still can't plan (a benchmark for LLMs on planning and reasoning about change),https://scholar.google.com/citations?view_op=view_citation&hl=en&user=yl3L07sAAAAJ&citation_for_view=yl3L07sAAAAJ:4UtermoNRQAC,2022
Subbarao Kambhampati,Plan explanations as model reconciliation: Moving beyond explanation as soliloquy,https://scholar.google.com/citations?view_op=view_citation&hl=en&user=yl3L07sAAAAJ&citation_for_view=yl3L07sAAAAJ:r7QigD7TRWAC,2017
Subbarao Kambhampati,On the planning abilities of large language models-a critical investigation,https://scholar.google.com/citations?view_op=view_citation&hl=en&user=yl3L07sAAAAJ&citation_for_view=yl3L07sAAAAJ:FuNQ1RLggQIC,2023
Subbarao Kambhampati,"Position: LLMs Can’t Plan, But Can Help Planning in LLM-Modulo Frameworks",https://scholar.google.com/citations?view_op=view_citation&hl=en&user=yl3L07sAAAAJ&citation_for_view=yl3L07sAAAAJ:pIp0rujYkN4C,2024
Subbarao Kambhampati,Planning as constraint satisfaction: Solving the planning graph by compiling it into CSP,https://scholar.google.com/citations?view_op=view_citation&hl=en&user=yl3L07sAAAAJ&citation_for_view=yl3L07sAAAAJ:IjCSPb-OGe4C,2001
Subbarao Kambhampati,A survey of moving target defenses for network security,https://scholar.google.com/citations?view_op=view_citation&hl=en&user=yl3L07sAAAAJ&citation_for_view=yl3L07sAAAAJ:9nEbuwLZtFEC,2020
Subbarao Kambhampati,Planbench: An extensible benchmark for evaluating large language models on planning and reasoning about change,https://scholar.google.com/citations?view_op=view_citation&hl=en&user=yl3L07sAAAAJ&citation_for_view=yl3L07sAAAAJ:5kgRglCLipYC,2023
Subbarao Kambhampati,Leveraging pre-trained large language models to construct and utilize world models for model-based task planning,https://scholar.google.com/citations?view_op=view_citation&hl=en&user=yl3L07sAAAAJ&citation_for_view=yl3L07sAAAAJ:DRUjQUnLNDcC,2023
Subbarao Kambhampati,Sapa: A multi-objective metric temporal planner,https://scholar.google.com/citations?view_op=view_citation&hl=en&user=yl3L07sAAAAJ&citation_for_view=yl3L07sAAAAJ:UeHWp8X0CEIC,2003
Subbarao Kambhampati,Planning as refinement search: A unified framework for evaluating design tradeoffs in partial-order planning,https://scholar.google.com/citations?view_op=view_citation&hl=en&user=yl3L07sAAAAJ&citation_for_view=yl3L07sAAAAJ:d1gkVwhDpl0C,1995
Subbarao Kambhampati,When is temporal planning really temporal?,https://scholar.google.com/citations?view_op=view_citation&hl=en&user=yl3L07sAAAAJ&citation_for_view=yl3L07sAAAAJ:dhFuZR0502QC,2007
Subbarao Kambhampati,Integration of biological sources: current systems and challenges ahead,https://scholar.google.com/citations?view_op=view_citation&hl=en&user=yl3L07sAAAAJ&citation_for_view=yl3L07sAAAAJ:9yKSN-GCB0IC,2004
Subbarao Kambhampati,Reviving partial order planning,https://scholar.google.com/citations?view_op=view_citation&hl=en&user=yl3L07sAAAAJ&citation_for_view=yl3L07sAAAAJ:qjMakFHDy7sC,2001
Subbarao Kambhampati,The emerging landscape of explainable ai planning and decision making,https://scholar.google.com/citations?view_op=view_citation&hl=en&user=yl3L07sAAAAJ&citation_for_view=yl3L07sAAAAJ:m1aD9PlKDecC,2020
Subbarao Kambhampati,Plan explicability and predictability for robot task planning,https://scholar.google.com/citations?view_op=view_citation&hl=en&user=yl3L07sAAAAJ&citation_for_view=yl3L07sAAAAJ:CoqsOaBEKcQC,2017
Subbarao Kambhampati,# metoo through the lens of social media,https://scholar.google.com/citations?view_op=view_citation&hl=en&user=yl3L07sAAAAJ&citation_for_view=yl3L07sAAAAJ:sFUlmsclzkgC,2018
Subbarao Kambhampati,Explicability? legibility? predictability? transparency? privacy? security? the emerging landscape of interpretable agent behavior,https://scholar.google.com/citations?view_op=view_citation&hl=en&user=yl3L07sAAAAJ&citation_for_view=yl3L07sAAAAJ:S1WaUgt8gYIC,2019
Teresa Wu,A model for inbound supply risk analysis,https://scholar.google.com/citations?view_op=view_citation&hl=en&user=XJvLrVAAAAAJ&citation_for_view=XJvLrVAAAAAJ:u5HHmVD_uO8C,2006
Teresa Wu,Methodology for supply chain disruption analysis,https://scholar.google.com/citations?view_op=view_citation&hl=en&user=XJvLrVAAAAAJ&citation_for_view=XJvLrVAAAAAJ:d1gkVwhDpl0C,2007
Teresa Wu,Learning brain connectivity of Alzheimer's disease by sparse inverse covariance estimation,https://scholar.google.com/citations?view_op=view_citation&hl=en&user=XJvLrVAAAAAJ&citation_for_view=XJvLrVAAAAAJ:LO7wyVUgiFcC,2010
Teresa Wu,Ten questions concerning occupant health in buildings during normal operations and extreme events including the COVID-19 pandemic,https://scholar.google.com/citations?view_op=view_citation&hl=en&user=XJvLrVAAAAAJ&citation_for_view=XJvLrVAAAAAJ:8_tS2Vw13FcC,2021
Teresa Wu,SD-CNN: A shallow-deep CNN for improved breast cancer diagnosis,https://scholar.google.com/citations?view_op=view_citation&hl=en&user=XJvLrVAAAAAJ&citation_for_view=XJvLrVAAAAAJ:ddB7do2jUx8C,2018
Teresa Wu,An adaptive particle swarm optimization with multiple adaptive methods,https://scholar.google.com/citations?view_op=view_citation&hl=en&user=XJvLrVAAAAAJ&citation_for_view=XJvLrVAAAAAJ:yD5IFk8b50cC,2012
Teresa Wu,Radiogenomics to characterize regional genetic heterogeneity in glioblastoma,https://scholar.google.com/citations?view_op=view_citation&hl=en&user=XJvLrVAAAAAJ&citation_for_view=XJvLrVAAAAAJ:fixghrsIJ_wC,2017
Teresa Wu,MMR: an algorithm for clustering categorical data using rough set theory,https://scholar.google.com/citations?view_op=view_citation&hl=en&user=XJvLrVAAAAAJ&citation_for_view=XJvLrVAAAAAJ:9yKSN-GCB0IC,2007
Teresa Wu,"PCDM: a decision support modeling methodology for supply chain, product and process design decisions",https://scholar.google.com/citations?view_op=view_citation&hl=en&user=XJvLrVAAAAAJ&citation_for_view=XJvLrVAAAAAJ:RGFaLdJalmkC,2005
Teresa Wu,"Evolution of operations management: past, present and future",https://scholar.google.com/citations?view_op=view_citation&hl=en&user=XJvLrVAAAAAJ&citation_for_view=XJvLrVAAAAAJ:O3NaXMp0MMsC,2007
Teresa Wu,Network-based approach to modelling uncertainty in a supply chain,https://scholar.google.com/citations?view_op=view_citation&hl=en&user=XJvLrVAAAAAJ&citation_for_view=XJvLrVAAAAAJ:u-x6o8ySG0sC,2004
Teresa Wu,Use of multimodality imaging and artificial intelligence for diagnosis and prognosis of early stages of Alzheimer's disease,https://scholar.google.com/citations?view_op=view_citation&hl=en&user=XJvLrVAAAAAJ&citation_for_view=XJvLrVAAAAAJ:v7LLNfYe7h0C,2018
Teresa Wu,Supplier evaluation and selection: an augmented DEA approach,https://scholar.google.com/citations?view_op=view_citation&hl=en&user=XJvLrVAAAAAJ&citation_for_view=XJvLrVAAAAAJ:YsMSGLbcyi4C,2009
Teresa Wu,Managing supply chain risk and vulnerability: tools and methods for supply chain decision makers,https://scholar.google.com/citations?view_op=view_citation&hl=en&user=XJvLrVAAAAAJ&citation_for_view=XJvLrVAAAAAJ:ufrVoPGSRksC,2009
Teresa Wu,Multi-parametric MRI and texture analysis to visualize spatial histologic heterogeneity and tumor extent in glioblastoma,https://scholar.google.com/citations?view_op=view_citation&hl=en&user=XJvLrVAAAAAJ&citation_for_view=XJvLrVAAAAAJ:6B7w4NK6UsoC,2015
Teresa Wu,Supply chain risk management: an agent-based simulation to study the impact of retail stockouts,https://scholar.google.com/citations?view_op=view_citation&hl=en&user=XJvLrVAAAAAJ&citation_for_view=XJvLrVAAAAAJ:TFP_iSt0sucC,2012
Teresa Wu,Accurate classification of chronic migraine via brain magnetic resonance imaging,https://scholar.google.com/citations?view_op=view_citation&hl=en&user=XJvLrVAAAAAJ&citation_for_view=XJvLrVAAAAAJ:jgBuDB5drN8C,2015
